{
  "$schema": "https://json-schema.org/draft/2020-12/schema",
  "title": "Trade research run pilot v1",
  "type": "object",
  "additionalProperties": false,
  "required": ["schema_version", "run_id", "attempt_id", "role", "nautilus_version", "input_identity_sha256", "source_files_sha256", "cost_model", "integrity", "evidence_grade", "raw_reports", "control_run_id"],
  "properties": {
    "schema_version": {"const": 1},
    "run_id": {"type": "string", "pattern": "^[A-Za-z0-9-]+$"},
    "attempt_id": {"type": "string"},
    "role": {"enum": ["candidate", "control", "diagnostic"]},
    "nautilus_version": {"type": "string", "minLength": 1},
    "input_identity_sha256": {"type": "string", "pattern": "^[0-9a-f]{64}$"},
    "source_files_sha256": {
      "type": "object",
      "minProperties": 1,
      "additionalProperties": {"type": "string", "pattern": "^[0-9a-f]{64}$"}
    },
    "source_revision": {
      "type": "object",
      "additionalProperties": false,
      "required": ["commit", "files"],
      "properties": {
        "commit": {"type": "string", "pattern": "^[0-9a-f]{9,40}$"},
        "files": {
          "type": "object",
          "minProperties": 1,
          "additionalProperties": {"type": "string", "pattern": "^[A-Za-z0-9_./-]+$"}
        }
      }
    },
    "window": {
      "type": "object",
      "additionalProperties": false,
      "required": ["input_start_utc", "trade_start_utc", "end_utc", "bar_minutes"],
      "properties": {
        "input_start_utc": {"type": "string"},
        "trade_start_utc": {"type": "string"},
        "end_utc": {"type": "string"},
        "bar_minutes": {"type": "integer", "minimum": 1}
      }
    },
    "account": {
      "type": "object",
      "additionalProperties": false,
      "required": ["model", "starting_balance_usdt", "sizing"],
      "properties": {
        "model": {"type": "string"},
        "starting_balance_usdt": {"type": "string"},
        "sizing": {"type": "object"}
      }
    },
    "cost_model": {"type": "string", "minLength": 1},
    "summary_ref": {"$ref": "#/$defs/file_ref"},
    "audit_ref": {"$ref": "#/$defs/file_ref"},
    "integrity": {"enum": ["passed", "failed", "unknown"]},
    "evidence_grade": {"enum": ["development_exposed", "independent", "unknown"]},
    "raw_reports": {"enum": ["sealed_local", "durable", "temporary", "unavailable"]},
    "artifact_manifest_ref": {"$ref": "#/$defs/file_ref"},
    "failure_reasons": {"type": "array", "items": {"type": "string", "minLength": 1}},
    "control_run_id": {"type": ["string", "null"]},
    "strategy_binding": {"$ref": "#/$defs/strategy_binding"},
    "runtime_identity": {"$ref": "#/$defs/runtime_identity"},
    "effective_config_sha256": {"type": "string", "pattern": "^[0-9a-f]{64}$"}
  },
  "allOf": [
    {
      "if": {"properties": {"integrity": {"const": "passed"}}},
      "then": {"required": ["window", "account", "summary_ref", "audit_ref"]}
    },
    {
      "if": {"properties": {"raw_reports": {"enum": ["sealed_local", "durable"]}}},
      "then": {"required": ["artifact_manifest_ref"]}
    },
    {"if": {"required": ["strategy_binding"]}, "then": {"required": ["runtime_identity", "effective_config_sha256"], "not": {"required": ["source_revision"]}}},
    {"if": {"anyOf": [{"required": ["runtime_identity"]}, {"required": ["effective_config_sha256"]}]}, "then": {"required": ["strategy_binding", "runtime_identity", "effective_config_sha256"]}}
  ],
  "$defs": {
    "strategy_binding": {"title": "Fixed Dolt strategy source binding", "type": "object", "additionalProperties": false, "required": ["database", "commit", "strategy_id", "revision", "source_sha256", "entry_class", "runtime_contract"], "properties": {"database": {"type": "string", "pattern": "^[A-Za-z_][A-Za-z0-9_]{0,63}$"}, "commit": {"type": "string", "pattern": "^[0-9a-v]{32}$"}, "strategy_id": {"type": "string", "pattern": "^[A-Za-z0-9][A-Za-z0-9_.-]{0,99}$"}, "revision": {"type": "integer", "minimum": 1, "maximum": 2147483647}, "source_sha256": {"type": "string", "pattern": "^[0-9a-f]{64}$"}, "entry_class": {"type": "string", "minLength": 1, "maxLength": 100}, "runtime_contract": {"enum": ["r1-native-v1", "r1-native-v2", "r1-native-v3", "r1-native-v4"]}}},
    "runtime_identity": {"type": "object", "additionalProperties": false, "required": ["image_ref", "image_digest", "platform", "runtime_contract"], "properties": {"image_ref": {"type": "string", "pattern": "^[A-Za-z0-9][A-Za-z0-9._:/-]*@sha256:[0-9a-f]{64}$"}, "image_digest": {"type": "string", "pattern": "^sha256:[0-9a-f]{64}$"}, "platform": {"enum": ["linux/arm64", "linux/amd64"]}, "runtime_contract": {"enum": ["r1-native-v1", "r1-native-v2", "r1-native-v3", "r1-native-v4"]}}},
    "file_ref": {
      "type": "object",
      "additionalProperties": false,
      "required": ["path", "sha256"],
      "properties": {
        "path": {"type": "string", "minLength": 1},
        "sha256": {"type": "string", "pattern": "^[0-9a-f]{64}$"}
      }
    }
  }
}
