{
  "schema_version": 1,
  "run_id": "H27a-historical-20261009",
  "attempt_id": "H27a",
  "role": "candidate",
  "nautilus_version": "2.0.0rc3",
  "input_identity_sha256": "ce9963ca68c66d34af74dbdbfff484f320a622fa73afe64844518aed354ec9fc",
  "source_files_sha256": {
    "strategy_source_sha256": "4337d9f3ab3249e1f1b6e665de500921946515f51ad1c8476136e2eac12a7092",
    "retracement_strategy_source_sha256": "19217066925b704c430b67b0495c677692dc62c7515c42fa6dd17e0295f18f03",
    "tiered_strategy_source_sha256": "456f88218f8eb2ce092a1783524875e254c1cf9d474e0550dfb39472b7d3328d",
    "structural_support_strategy_source_sha256": "02f84fc30c36ea63d5672fe8620f236ed4d9717f519c102052585fe1035f9ad8",
    "broad_swing_signal_source_sha256": "c8dcb097b924dc90339207bf3f751fc88b3b95acf9512ba3689ab62e4e7b57cd",
    "runner_source_sha256": "fc25be6abbdea0527fb26d02457a58a0f57bc0c5440f76b3b2f420c30ac79b96"
  },
  "window": {
    "input_start_utc": "2025-10-07T00:00:00Z",
    "trade_start_utc": "2025-10-17T00:00:00+00:00",
    "end_utc": "2026-10-07T08:30:00Z",
    "bar_minutes": 5
  },
  "account": {
    "model": "one native BacktestEngine margin account, 100000 USDT, 37 strategies sharing portfolio capital",
    "starting_balance_usdt": "100000",
    "sizing": {
      "mode": "native_equity_stop_risk_with_notional_cap",
      "risk_budget_bps": 25.0,
      "coin_notional_cap_pct": 5.0
    }
  },
  "cost_model": "Binance USD-M current Instrument terms, native fill fees and historical Catalog funding; BacktestEngine rc3",
  "summary_ref": {
    "path": "research/r1_native/results/2026-10-09-h27a-37-summary.json",
    "sha256": "38df405e9df35a98e526888428afb65630075da636a23317d710908199e53f6a"
  },
  "audit_ref": {
    "path": "research/r1_native/results/2026-10-09-h27a-37-native-audit.json",
    "sha256": "5598cdd1c878f0d18cf630746dacd6219e696d6721495c50543a9d8e0875d437"
  },
  "integrity": "passed",
  "evidence_grade": "development_exposed",
  "raw_reports": "temporary",
  "control_run_id": "H27a-H26a-control-20261009"
}
