{
  "schema_version": 1,
  "run_id": "F01-10-20261008",
  "attempt_id": "H19a",
  "role": "control",
  "nautilus_version": "2.0.0rc3",
  "input_identity_sha256": "ce9963ca68c66d34af74dbdbfff484f320a622fa73afe64844518aed354ec9fc",
  "source_files_sha256": {
    "strategy_source_sha256": "5e0304ebb41e9f8f865d18220c31050fb93a8384aedbe13eea847c4940fe0556",
    "retracement_strategy_source_sha256": "19217066925b704c430b67b0495c677692dc62c7515c42fa6dd17e0295f18f03",
    "tiered_strategy_source_sha256": "5eb40665d1c9342ceef5c1c04c448bf211d60635c5142e0411e7d2691c506f28",
    "broad_swing_signal_source_sha256": "c8dcb097b924dc90339207bf3f751fc88b3b95acf9512ba3689ab62e4e7b57cd",
    "runner_source_sha256": "6e9b2d69d5685a4ec0b0ee7b763c4328462e95707c92230dcecb37eae78c9d68"
  },
  "source_revision": {
    "commit": "2349502cb",
    "files": {
      "strategy_source_sha256": "strategies/r1/strategy.py",
      "retracement_strategy_source_sha256": "strategies/r1/retracement_strategy.py",
      "tiered_strategy_source_sha256": "strategies/r1/tiered_retracement_strategy.py",
      "broad_swing_signal_source_sha256": "strategies/r1/broad_swing_signal.py",
      "runner_source_sha256": "strategies/r1/run_portfolio.py"
    }
  },
  "window": {
    "input_start_utc": "2025-10-07T00:00:00Z",
    "trade_start_utc": "2025-10-17T00:00:00+00:00",
    "end_utc": "2026-10-07T08:30:00Z",
    "bar_minutes": 5
  },
  "account": {
    "model": "one native BacktestNode margin account, 100000 USDT, 37 strategies sharing portfolio capital",
    "starting_balance_usdt": "100000",
    "sizing": {
      "mode": "native_equity_stop_risk_with_notional_cap",
      "risk_budget_bps": 25.0,
      "coin_notional_cap_pct": 5.0
    }
  },
  "cost_model": "F01 frozen native Binance USDT perpetual terms; VIP0 fallback fees and Catalog funding",
  "summary_ref": {
    "path": "reports/r1_factorial_f01/10-summary.json",
    "sha256": "fe1222fbf9bfb768903e5d7ead81150c85d0db854634b9225a653344a50317c1"
  },
  "audit_ref": {
    "path": "reports/r1_factorial_f01/10-audit.json",
    "sha256": "a3e24ba7ab1d0fb418cdae92f08523246c4da2f4240dca4b0d31cfef5a25b30f"
  },
  "integrity": "passed",
  "evidence_grade": "development_exposed",
  "raw_reports": "temporary",
  "control_run_id": null
}
