{
  "schema_version": 1,
  "run_id": "H18a-2026-10-08",
  "attempt_id": "H18a",
  "role": "candidate",
  "nautilus_version": "2.0.0rc3",
  "input_identity_sha256": "ce9963ca68c66d34af74dbdbfff484f320a622fa73afe64844518aed354ec9fc",
  "source_files_sha256": {
    "strategy_source_sha256": "0ff71ec046d02f47bd69147d44a5e70612b5af0af76429f7ffe9e4b7b90fb2f9",
    "retracement_strategy_source_sha256": "1cf4b5240f4341d24dbcf98c8755ee5d424c3882cb1d4369b645549eefdbb12e",
    "tiered_strategy_source_sha256": "f124a8d0aa3c1480986f146d353af58e6b59b7ce1542177699cff6ed1eb1b36e",
    "runner_source_sha256": "f8b67f315e786a3c5b58cc9bff8b1eb7962e042c77ec958f917b3c83d59a30c8"
  },
  "source_revision": {
    "commit": "e5a882101",
    "files": {
      "strategy_source_sha256": "research/r1_native/strategy.py",
      "retracement_strategy_source_sha256": "research/r1_native/retracement_strategy.py",
      "tiered_strategy_source_sha256": "research/r1_native/tiered_retracement_strategy.py",
      "runner_source_sha256": "research/r1_native/run_portfolio.py"
    }
  },
  "window": {
    "input_start_utc": "2025-10-07T00:00:00Z",
    "trade_start_utc": "2025-10-17T00:00:00+00:00",
    "end_utc": "2026-10-07T08:30:00Z",
    "bar_minutes": 5
  },
  "account": {
    "model": "one native BacktestEngine margin account, 100000 USDT, 37 strategies sharing portfolio capital",
    "starting_balance_usdt": "100000",
    "sizing": {
      "mode": "native_equity_stop_risk_with_notional_cap",
      "risk_budget_bps": 25.0,
      "coin_notional_cap_pct": 5.0
    }
  },
  "cost_model": "ledger H18a paired native Binance USDT perpetual terms; VIP0 fallback fees and Catalog funding",
  "summary_ref": {
    "path": "research/r1_native/results/2026-10-08-h18a-37-summary.json",
    "sha256": "6afbecee4000071cd3f03f7cdf04026eac78dc93ced3e31891cfc597288bcd4e"
  },
  "audit_ref": {
    "path": "research/r1_native/results/2026-10-08-h18a-37-native-audit.json",
    "sha256": "d77722e69162f1b2e45709fdb7dbbcf97951722f3861a8fee35f0e4273e59995"
  },
  "integrity": "passed",
  "evidence_grade": "development_exposed",
  "raw_reports": "temporary",
  "control_run_id": "H15a-paired-2026-10-08"
}
