{
  "schema_version": 1,
  "run_id": "H18a-paired-2026-10-08",
  "attempt_id": "H18a",
  "role": "control",
  "nautilus_version": "2.0.0rc3",
  "input_identity_sha256": "ce9963ca68c66d34af74dbdbfff484f320a622fa73afe64844518aed354ec9fc",
  "source_files_sha256": {
    "strategy_source_sha256": "2570d5419fbbed0f086410a9bc6cb2b03582d11fc3d3c180888ea698f6703c68",
    "retracement_strategy_source_sha256": "1cf4b5240f4341d24dbcf98c8755ee5d424c3882cb1d4369b645549eefdbb12e",
    "tiered_strategy_source_sha256": "fb4c1a689f9734c27b354c0a97c89d45ec9ae4ee1928896e14c0699c0c623e36",
    "runner_source_sha256": "e49d7db11d5d0be9d2a09449eeab7c55663aff75fba6d006aab23cc2d8d7a430"
  },
  "window": {
    "input_start_utc": "2025-10-07T00:00:00Z",
    "trade_start_utc": "2025-10-17T00:00:00+00:00",
    "end_utc": "2026-10-07T08:30:00Z",
    "bar_minutes": 5
  },
  "account": {
    "model": "one native BacktestEngine margin account, 100000 USDT, 37 strategies sharing portfolio capital",
    "starting_balance_usdt": "100000",
    "sizing": {
      "mode": "native_equity_stop_risk_with_notional_cap",
      "risk_budget_bps": 25.0,
      "coin_notional_cap_pct": 5.0
    }
  },
  "cost_model": "ledger H19a paired native Binance USDT perpetual terms; VIP0 fallback fees and Catalog funding",
  "summary_ref": {
    "path": "research/r1_native/results/2026-10-08-h19a-paired-h18a-37-summary.json",
    "sha256": "6298b850bc3100c7845dc9ee801ae4a899f3a94c64a5004ec2bdf0c61a8b8c80"
  },
  "audit_ref": {
    "path": "research/r1_native/results/2026-10-08-h19a-paired-h18a-37-native-audit.json",
    "sha256": "aa84512bc6565542d6aabe9e9501215bceb24a5579fad57a76b1c55fa25cf24b"
  },
  "integrity": "passed",
  "evidence_grade": "development_exposed",
  "raw_reports": "temporary",
  "control_run_id": null
}
