{
  "schema_version": 1,
  "run_id": "CUSTODY-F01-37-20261008",
  "attempt_id": "F01",
  "role": "candidate",
  "nautilus_version": "2.0.0rc3",
  "input_identity_sha256": "ce9963ca68c66d34af74dbdbfff484f320a622fa73afe64844518aed354ec9fc",
  "source_files_sha256": {
    "strategy_source_sha256": "5e0304ebb41e9f8f865d18220c31050fb93a8384aedbe13eea847c4940fe0556",
    "retracement_strategy_source_sha256": "19217066925b704c430b67b0495c677692dc62c7515c42fa6dd17e0295f18f03",
    "tiered_strategy_source_sha256": "5eb40665d1c9342ceef5c1c04c448bf211d60635c5142e0411e7d2691c506f28",
    "broad_swing_signal_source_sha256": "c8dcb097b924dc90339207bf3f751fc88b3b95acf9512ba3689ab62e4e7b57cd",
    "runner_source_sha256": "6e9b2d69d5685a4ec0b0ee7b763c4328462e95707c92230dcecb37eae78c9d68"
  },
  "source_revision": {
    "commit": "e0412366d2835eb9851e04cabcc5c0f52fd74247",
    "files": {
      "strategy_source_sha256": "strategies/r1/strategy.py",
      "retracement_strategy_source_sha256": "strategies/r1/retracement_strategy.py",
      "tiered_strategy_source_sha256": "strategies/r1/tiered_retracement_strategy.py",
      "broad_swing_signal_source_sha256": "strategies/r1/broad_swing_signal.py",
      "runner_source_sha256": "strategies/r1/run_portfolio.py"
    }
  },
  "cost_model": "F01 frozen native Binance USDT perpetual terms; VIP0 fallback fees and Catalog funding",
  "artifact_manifest_ref": {
    "path": "artifact://CUSTODY-F01-37-20261008/manifest.json",
    "sha256": "cfe63e0a21f5c2225af942afd2d71b17da009e736bca22abe29c160df461bdce"
  },
  "integrity": "passed",
  "evidence_grade": "development_exposed",
  "raw_reports": "sealed_local",
  "control_run_id": "F01-10-20261008",
  "window": {
    "input_start_utc": "2025-10-07T00:00:00Z",
    "trade_start_utc": "2025-10-17T00:00:00+00:00",
    "end_utc": "2026-10-07T08:30:00Z",
    "bar_minutes": 5
  },
  "account": {
    "model": "one native BacktestNode margin account, 100000 USDT, 37 strategies sharing portfolio capital",
    "starting_balance_usdt": "100000",
    "sizing": {
      "mode": "native_equity_stop_risk_with_notional_cap",
      "risk_budget_bps": 25.0,
      "coin_notional_cap_pct": 5.0
    }
  },
  "summary_ref": {
    "path": "artifact://CUSTODY-F01-37-20261008/reports/summary.json",
    "sha256": "b173f4263f3921518bd9533c294e681d6dd4c1fcaad2b12b671003e71685102a"
  },
  "audit_ref": {
    "path": "artifact://CUSTODY-F01-37-20261008/reports/audit.json",
    "sha256": "aa01ad8e41ed4425d835218cc386d0c960943c394a3499cf354ca4505aa3d6c4"
  }
}
